{
  "schemaVersion": "2.0",
  "cardName": "Bloodbraid Elf",
  "articleClass": "tournament-pillar",
  "secondaryClasses": [
    "banned-or-restricted-card",
    "design-landmark"
  ],
  "thesis": "Bloodbraid Elf defined an era of midrange because it compressed pressure and card advantage into one cast trigger, making every four-mana play both a creature and a curated second spell.",
  "canonicalIdentity": {
    "oracleId": "3f0c9466-5ab9-4205-a84f-b4b27b5a678e",
    "oracleName": "Bloodbraid Elf",
    "firstPrintingSetCode": "arb",
    "firstPrintingSetName": "Alara Reborn",
    "releaseDate": "2009-04-30",
    "scryfallId": "7ef67487-c8e5-49bb-b0f7-e073ff2e31f1",
    "illustrationId": "5493c08d-f6c9-4c20-9382-56edb4e34e8f",
    "originalArtist": "Dominick Domingo",
    "originalPrintedText": "Haste (This creature can attack and {T} as soon as it comes under your control.) Cascade (When you cast this spell, exile cards from the top of your library until you exile a nonland card that costs less. You may cast it without paying its mana cost. Put the exiled cards on the bottom in a random order.)",
    "currentOracleText": "Haste (This creature can attack and {T} as soon as it comes under your control.) Cascade (When you cast this spell, exile cards from the top of your library until you exile a nonland card that costs less. You may cast it without paying its mana cost. Put the exiled cards on the bottom in a random order.)",
    "promotionalDebut": false,
    "identityNotes": "Canonical identity pinned to the project card-data snapshot and original regular printing."
  },
  "originalContext": {
    "setEnvironment": "Original release in Alara Reborn.",
    "designPurpose": "Card-specific development and historical role documented in the reviewed essay.",
    "initialReception": "The article separates release context from later tournament reputation.",
    "sourceIds": [
      "source-1",
      "source-2",
      "source-3"
    ]
  },
  "loreContext": {
    "scope": "flavor-only",
    "summary": "Artwork, setting, depicted role, and cultural memory are discussed to the extent supported by official card and design sources.",
    "depictedMoment": "See the article art and memory section.",
    "relatedStoryCards": [],
    "sourceIds": [
      "source-1",
      "source-2"
    ]
  },
  "competitiveTimeline": [
    {
      "date": "historical",
      "significance": "The article and documentary deck archive trace representative competitive eras.",
      "sourceIds": [
        "source-4",
        "source-5",
        "source-6",
        "source-7",
        "source-8",
        "source-9",
        "source-10"
      ]
    }
  ],
  "playbook": {
    "role": "Card-specific strategic role is explained.",
    "deckRequirements": "Mana, curve, support, and structural requirements are identified.",
    "copyCount": "Documentary lists preserve historical copy counts.",
    "mulligans": "Opening-hand risks and dependencies are discussed.",
    "sequencing": "Concrete timing and priority decisions are provided.",
    "sideboarding": "Narrow cards and matchup roles are discussed without freezing a current metagame.",
    "commonMistakes": "The article identifies recurring sequencing and evaluation errors."
  },
  "counterplay": {
    "directAnswers": "Direct answers are separated by timing window.",
    "engineDisruption": "The article distinguishes the subject from its enabling package.",
    "timingWindows": "Pre-resolution, trigger, activation, and combat windows are identified.",
    "racing": "The article explains when pressure is superior to direct interaction.",
    "sideboarding": "Broad sideboard approaches are described."
  },
  "deckEvidence": [
    {
      "deckKind": "tournament-registration",
      "deckName": "David Reitbauer — 2009 World Championship",
      "format": "2nd place · ZEN standard · 2009-11-22",
      "date": "historical",
      "sourceId": "source-4",
      "reviewedBy": "Compulsive Research Editorial V2"
    },
    {
      "deckKind": "tournament-registration",
      "deckName": "Simon Goertzen — Pro Tour San Diego 2010",
      "format": "1st place · WWK standard · 2010-02-21",
      "date": "historical",
      "sourceId": "source-5",
      "reviewedBy": "Compulsive Research Editorial V2"
    },
    {
      "deckKind": "tournament-registration",
      "deckName": "Yuuya Watanabe — 2012 Players Championship",
      "format": "1st place · modern thru M13 · 2012-08-31",
      "date": "historical",
      "sourceId": "source-6",
      "reviewedBy": "Compulsive Research Editorial V2"
    },
    {
      "deckKind": "tournament-registration",
      "deckName": "Zhiyang Zhang — Mythic Championship IV",
      "format": "4th place · modern thru M20 · 2019-07-28",
      "date": "historical",
      "sourceId": "source-7",
      "reviewedBy": "Compulsive Research Editorial V2"
    }
  ],
  "claims": [
    {
      "claimId": "central-thesis",
      "summary": "Bloodbraid Elf defined an era of midrange because it compressed pressure and card advantage into one cast trigger, making every four-mana play both a creature and a curated second spell.",
      "sourceIds": [
        "source-1",
        "source-2",
        "source-3",
        "source-4",
        "source-5"
      ],
      "confidence": "high",
      "asOf": "2026-08-02"
    }
  ],
  "sources": [
    {
      "sourceId": "source-1",
      "title": "Scryfall printing catalog for Bloodbraid Elf",
      "url": "https://scryfall.com/search?q=%21%22Bloodbraid%20Elf%22&unique=prints&as=grid&order=released",
      "sourceType": "database",
      "accessedDate": "2026-08-02",
      "supports": "Card identity, printings, images, and current legality snapshot."
    },
    {
      "sourceId": "source-2",
      "title": "Gatherer card record",
      "url": "https://gatherer.wizards.com/Pages/Search/Default.aspx?name=+%5BBloodbraid%20Elf%5D",
      "sourceType": "primary",
      "accessedDate": "2026-08-02",
      "supports": "Official Oracle text and rulings."
    },
    {
      "sourceId": "source-3",
      "title": "Double Masters 2022 Release Notes",
      "url": "https://magic.wizards.com/en/news/feature/double-masters-2022-release-notes-2022-06-24",
      "sourceType": "primary",
      "accessedDate": "2026-08-02",
      "supports": "Official cascade rules and card-specific clarifications."
    },
    {
      "sourceId": "source-4",
      "title": "A Brief History of the Modern Banned List",
      "url": "https://magic.wizards.com/en/news/feature/brief-history-modern-banned-list-2015-02-03",
      "sourceType": "primary",
      "accessedDate": "2026-08-02",
      "supports": "Primary retrospective on the January 2013 Modern ban."
    },
    {
      "sourceId": "source-5",
      "title": "Worlds 2009 — David Reitbauer",
      "url": "https://www.mtgtop8.com/event?d=164665&e=443",
      "sourceType": "database",
      "accessedDate": "2026-08-02",
      "supports": "Runner-up Standard Jund registration."
    },
    {
      "sourceId": "source-6",
      "title": "Pro Tour San Diego 2010",
      "url": "https://www.mtgtop8.com/event?d=174119&e=448&f=ST",
      "sourceType": "database",
      "accessedDate": "2026-08-02",
      "supports": "Simon Görtzen’s winning Standard Jund registration."
    },
    {
      "sourceId": "source-7",
      "title": "2012 Players Championship",
      "url": "https://www.mtgtop8.com/event?d=219671&e=3138&f=MO",
      "sourceType": "database",
      "accessedDate": "2026-08-02",
      "supports": "Yuuya Watanabe’s winning Modern Jund registration."
    },
    {
      "sourceId": "source-8",
      "title": "Mythic Championship IV Barcelona",
      "url": "https://www.mtgtop8.com/event?e=22610&f=MO",
      "sourceType": "database",
      "accessedDate": "2026-08-02",
      "supports": "Post-unban Modern Jund result."
    },
    {
      "sourceId": "source-9",
      "title": "February 15, 2021 Banned and Restricted Announcement",
      "url": "https://magic.wizards.com/en/news/announcements/february-15-2021-banned-and-restricted-announcement",
      "sourceType": "primary",
      "accessedDate": "2026-08-02",
      "supports": "Official cascade rules change for modal double-faced cards."
    },
    {
      "sourceId": "source-10",
      "title": "Official Banned & Restricted list",
      "url": "https://magic.wizards.com/en/banned-restricted-list",
      "sourceType": "primary",
      "accessedDate": "2026-08-02",
      "supports": "Current sanctioned-format legality as of the review date."
    }
  ],
  "researchStatus": "complete",
  "review": {
    "historicalReviewDate": "2026-08-02",
    "currentInformationAsOf": "2026-08-02",
    "editorialReviewer": "OpenAI / Compulsive Research Editorial V2",
    "openQuestions": []
  }
}