{
  "schemaVersion": "2.0",
  "cardName": "Atog",
  "articleClass": "tournament-pillar",
  "secondaryClasses": [],
  "thesis": "Atog turns every artifact into two temporary power, converting expendable material and threatened permanents into a sudden lethal attack.",
  "canonicalIdentity": {
    "oracleId": "3095f2cf-05c3-4381-929f-c526b6fc30a7",
    "oracleName": "Atog",
    "firstPrintingSetCode": "atq",
    "firstPrintingSetName": "Antiquities",
    "releaseDate": "1994-03-04",
    "scryfallId": "2249fc40-4412-48fd-800a-7ea3678aee3f",
    "illustrationId": "c36d0b2f-ec4c-48f5-ba69-5a1154038583",
    "originalArtist": "Jesper Myrfors",
    "currentOracleText": "Sacrifice an artifact: This creature gets +2/+2 until end of turn.",
    "promotionalDebut": false,
    "identityNotes": "Original Antiquities 1994-03-04 credited to Jesper Myrfors; printing ID remains from accepted snapshot. Modern Oracle text is not misidentified as original printed wording. Verified focused mechanics source: https://mtg.wtf/card/atq/23/Atog"
  },
  "originalContext": {
    "setEnvironment": "Antiquities original printing, 1994-03-04",
    "designPurpose": "Atog is a two-mana 1/2 whose free activated ability sacrifices an artifact to give it +2/+2 until end of turn. The resource conversion is powerful but permanent and not reversible.",
    "initialReception": "No invented contemporary launch reception. Narrative interpretation is separated from published historical evidence.",
    "sourceIds": [
      "original-printing",
      "official-rules"
    ]
  },
  "loreContext": {
    "scope": "flavor-only",
    "summary": "Original artwork credit Jesper Myrfors; no undocumented canonical story or attributed quote invented.",
    "relatedStoryCards": [],
    "sourceIds": [
      "original-printing"
    ]
  },
  "competitiveTimeline": [
    {
      "date": "1994-03-04",
      "event": "Antiquities initial release",
      "significance": "Atog initial printed identity; original artist Jesper Myrfors.",
      "sourceIds": [
        "original-printing"
      ]
    }
  ],
  "playbook": {
    "role": "Atog is a two-mana 1/2 whose free activated ability sacrifices an artifact to give it +2/+2 until end of turn. The resource conversion is powerful but permanent and not reversible.",
    "deckRequirements": "Check color requirements, actual mana producers and supporting card pool; do not infer a historical player from an illustrative scene.",
    "copyCount": "Consult documentary deck rows for exact observed counts; illustrative models do not prove event popularity.",
    "mulligans": "Do not treat a combo or lock piece as a mana source or early threat without the cards required to support it.",
    "sequencing": "On an unblocked Atog with opponent at five, sacrificing two artifact permanents during combat makes a 5/6 that can deal lethal five combat damage. The artifacts are sacrificed immediately as activation costs, so removing Atog in response does not bring them back.",
    "sideboarding": "Specific opponent-dependent decisions require real format/date and opposing deck evidence.",
    "commonMistakes": "Each sacrificed artifact is paid as a cost, giving Atog +2/+2 through end of turn. From 1/2, two sacrifices make it 5/6. Sacrificing an artifact land does not make another land drop available."
  },
  "counterplay": {
    "directAnswers": "Appropriate counterspells or removal at the legal timing window, or attacking the enabling cards and resources.",
    "engineDisruption": "Check the supporting artifacts, enchantments, creatures or mana engine separately from the featured card.",
    "timingWindows": "On an unblocked Atog with opponent at five, sacrificing two artifact permanents during combat makes a 5/6 that can deal lethal five combat damage. The artifacts are sacrificed immediately as activation costs, so removing Atog in response does not bring them back.",
    "racing": "Compare the setup cost with opposing clock and available mana.",
    "sideboarding": "No blanket sideboard advice without a verified deck pairing."
  },
  "deckEvidence": [
    {
      "deckKind": "tournament-registration",
      "deckName": "Kamiel Cornelissen — 2004 World Championship 5th place · 5DN standard · 2004-09-05",
      "format": "See article deck archive.",
      "date": "historical",
      "sourceId": "archived-deck-candidate",
      "reviewedBy": "Inherited or newly authored candidate; independent historical attribution is unverified"
    },
    {
      "deckKind": "tournament-registration",
      "deckName": "Chikara Nakajima — Pro Tour Philadelphia 2011 Semifinalist · modern thru M12 · 2011-09-04",
      "format": "See article deck archive.",
      "date": "historical",
      "sourceId": "archived-deck-candidate",
      "reviewedBy": "Inherited or newly authored candidate; independent historical attribution is unverified"
    },
    {
      "deckKind": "tournament-registration",
      "deckName": "The Balance Deck Wizards historical archive · Early Type I",
      "format": "See article deck archive.",
      "date": "historical",
      "sourceId": "archived-deck-candidate",
      "reviewedBy": "Inherited or newly authored candidate; independent historical attribution is unverified"
    }
  ],
  "claims": [
    {
      "claimId": "printing-identity",
      "summary": "Antiquities 1994-03-04, credited artist Jesper Myrfors.",
      "sourceIds": [
        "original-printing"
      ],
      "confidence": "high",
      "asOf": "2026-10-27"
    },
    {
      "claimId": "mechanics-sequence",
      "summary": "Each sacrificed artifact is paid as a cost, giving Atog +2/+2 through end of turn. From 1/2, two sacrifices make it 5/6. Sacrificing an artifact land does not make another land drop available. On an unblocked Atog with opponent at five, sacrificing two artifact permanents during combat makes a 5/6 that can deal lethal five combat damage. The artifacts are sacrificed immediately as activation costs, so removing Atog in response does not bring them back.",
      "sourceIds": [
        "original-printing",
        "official-rules"
      ],
      "confidence": "high",
      "asOf": "2026-10-27"
    }
  ],
  "sources": [
    {
      "sourceId": "original-printing",
      "title": "Atog original printing and rulings",
      "url": "https://mtg.wtf/card/atq/23/Atog",
      "sourceType": "database",
      "accessedDate": "2026-10-27",
      "supports": "Original date, printed card, artist and explicit rulings."
    },
    {
      "sourceId": "official-rules",
      "title": "Magic Comprehensive Rules",
      "url": "https://magic.wizards.com/en/rules",
      "sourceType": "primary",
      "accessedDate": "2026-10-27",
      "supports": "Current triggered ability, costs, timing, targeting, casting and resolution mechanics."
    },
    {
      "sourceId": "archived-deck-candidate",
      "title": "Preserved Compulsive Research deck-archive entry — external verification pending",
      "url": "https://github.com/Diabolicdonut/Compulsive-Research/blob/main/080-atog.html",
      "sourceType": "database",
      "accessedDate": "2026-10-27",
      "supports": "Only the text of a preserved candidate deck list, NOT verification of player, date, registration or placement."
    }
  ],
  "researchStatus": "in-research",
  "review": {
    "historicalReviewDate": "2026-10-27",
    "currentInformationAsOf": "2026-10-27",
    "editorialReviewer": "Compulsive Research focused 063-072 candidate preparation",
    "openQuestions": [
      "Verify inherited third-party tournament registrations and older article sections separately. These core-mechanics fixes alone do not accept the complete Reader migration wave."
    ]
  }
}
