{
  "schemaVersion": "2.0",
  "cardName": "Eureka",
  "articleClass": "tournament-pillar",
  "secondaryClasses": [],
  "thesis": "Eureka invites both players to place permanents onto the battlefield, but deck construction can make the apparently equal exchange overwhelmingly one-sided.",
  "canonicalIdentity": {
    "oracleId": "917f2b4b-79ec-4ded-b4c8-cbcf363cb23b",
    "oracleName": "Eureka",
    "firstPrintingSetCode": "leg",
    "firstPrintingSetName": "Legends",
    "releaseDate": "1994-06-01",
    "scryfallId": "520db5fb-d961-45a3-af74-6f054b8be3ab",
    "illustrationId": "4dbd9ada-19fb-47e1-b05b-d2fd21916d70",
    "originalArtist": "Kaja Foglio",
    "currentOracleText": "Starting with you, each player may put a permanent card from their hand onto the battlefield. Repeat this process until no one puts a card onto the battlefield.",
    "promotionalDebut": false,
    "identityNotes": "Original Legends 1994-06-01 credited to Kaja Foglio; printing ID remains from accepted snapshot. Modern Oracle text is not misidentified as original printed wording. Verified focused mechanics source: https://mtg.wtf/card/leg/185/Eureka"
  },
  "originalContext": {
    "setEnvironment": "Legends original printing, 1994-06-01",
    "designPurpose": "Eureka is a four-mana invitation to both players to put permanents from their hands onto the battlefield. One pass does not necessarily finish the sequence.",
    "initialReception": "No invented contemporary launch reception. Narrative interpretation is separated from published historical evidence.",
    "sourceIds": [
      "original-printing",
      "official-rules"
    ]
  },
  "loreContext": {
    "scope": "flavor-only",
    "summary": "Original artwork credit Kaja Foglio; no undocumented canonical story or attributed quote invented.",
    "relatedStoryCards": [],
    "sourceIds": [
      "original-printing"
    ]
  },
  "competitiveTimeline": [
    {
      "date": "1994-06-01",
      "event": "Legends initial release",
      "significance": "Eureka initial printed identity; original artist Kaja Foglio.",
      "sourceIds": [
        "original-printing"
      ]
    }
  ],
  "playbook": {
    "role": "Eureka is a four-mana invitation to both players to put permanents from their hands onto the battlefield. One pass does not necessarily finish the sequence.",
    "deckRequirements": "Check color requirements, actual mana producers and supporting card pool; do not infer a historical player from an illustrative scene.",
    "copyCount": "Consult documentary deck rows for exact observed counts; illustrative models do not prove event popularity.",
    "mulligans": "Do not treat a combo or lock piece as a mana source or early threat without the cards required to support it.",
    "sequencing": "During resolution both players may put permanent cards onto the battlefield in turn. The first pass is not a permanent waiver. Enters-the-battlefield triggers wait until the spell finishes resolving before joining the stack; cast triggers do not fire for these objects.",
    "sideboarding": "Specific opponent-dependent decisions require real format/date and opposing deck evidence.",
    "commonMistakes": "Players take turns choosing permanents; a player who declines a turn can still place one later if the process continues. The sequence ends only after all players consecutively decline to put a card onto the battlefield, and cards put onto the battlefield are not cast."
  },
  "counterplay": {
    "directAnswers": "Appropriate counterspells or removal at the legal timing window, or attacking the enabling cards and resources.",
    "engineDisruption": "Check the supporting artifacts, enchantments, creatures or mana engine separately from the featured card.",
    "timingWindows": "During resolution both players may put permanent cards onto the battlefield in turn. The first pass is not a permanent waiver. Enters-the-battlefield triggers wait until the spell finishes resolving before joining the stack; cast triggers do not fire for these objects.",
    "racing": "Compare the setup cost with opposing clock and available mana.",
    "sideboarding": "No blanket sideboard advice without a verified deck pairing."
  },
  "deckEvidence": [
    {
      "deckKind": "curated-example",
      "deckName": "Groundhog Day — Nested Draw Control Old School novelty-control construction · documented 63/15",
      "format": "See article deck archive.",
      "date": "historical",
      "sourceId": "archived-deck-candidate",
      "reviewedBy": "Inherited or newly authored candidate; independent historical attribution is unverified"
    }
  ],
  "claims": [
    {
      "claimId": "printing-identity",
      "summary": "Legends 1994-06-01, credited artist Kaja Foglio.",
      "sourceIds": [
        "original-printing"
      ],
      "confidence": "high",
      "asOf": "2026-10-27"
    },
    {
      "claimId": "mechanics-sequence",
      "summary": "Players take turns choosing permanents; a player who declines a turn can still place one later if the process continues. The sequence ends only after all players consecutively decline to put a card onto the battlefield, and cards put onto the battlefield are not cast. During resolution both players may put permanent cards onto the battlefield in turn. The first pass is not a permanent waiver. Enters-the-battlefield triggers wait until the spell finishes resolving before joining the stack; cast triggers do not fire for these objects.",
      "sourceIds": [
        "original-printing",
        "official-rules"
      ],
      "confidence": "high",
      "asOf": "2026-10-27"
    }
  ],
  "sources": [
    {
      "sourceId": "original-printing",
      "title": "Eureka original printing and rulings",
      "url": "https://mtg.wtf/card/leg/185/Eureka",
      "sourceType": "database",
      "accessedDate": "2026-10-27",
      "supports": "Original date, printed card, artist and explicit rulings."
    },
    {
      "sourceId": "official-rules",
      "title": "Magic Comprehensive Rules",
      "url": "https://magic.wizards.com/en/rules",
      "sourceType": "primary",
      "accessedDate": "2026-10-27",
      "supports": "Current triggered ability, costs, timing, targeting, casting and resolution mechanics."
    },
    {
      "sourceId": "archived-deck-candidate",
      "title": "Preserved Compulsive Research deck-archive entry — external verification pending",
      "url": "https://github.com/Diabolicdonut/Compulsive-Research/blob/main/069-eureka.html",
      "sourceType": "database",
      "accessedDate": "2026-10-27",
      "supports": "Only the text of a preserved candidate deck list, NOT verification of player, date, registration or placement."
    }
  ],
  "researchStatus": "in-research",
  "review": {
    "historicalReviewDate": "2026-10-27",
    "currentInformationAsOf": "2026-10-27",
    "editorialReviewer": "Compulsive Research focused 063-072 candidate preparation",
    "openQuestions": [
      "Verify inherited third-party tournament registrations and older article sections separately. These core-mechanics fixes alone do not accept the complete Reader migration wave."
    ]
  }
}
