{
  "schemaVersion": "2.0",
  "cardName": "Transmute Artifact",
  "articleClass": "tournament-pillar",
  "secondaryClasses": [],
  "thesis": "Transmute Artifact turned an expendable artifact into the exact machine a deck needed, previewing the dangerous tutor-and-cheat design space later occupied by Tinker.",
  "canonicalIdentity": {
    "oracleId": "dbe792f9-22be-4972-b418-99a6190c4421",
    "oracleName": "Transmute Artifact",
    "firstPrintingSetCode": "atq",
    "firstPrintingSetName": "Antiquities",
    "releaseDate": "1994-03-04",
    "scryfallId": "6eab6765-eba3-4844-81ca-ae37a6e903df",
    "illustrationId": "a70ea4e2-45c7-40e5-a21e-37e6c9c89e0f",
    "originalArtist": "Anson Maddocks",
    "currentOracleText": "Sacrifice an artifact. If you do, search your library for an artifact card. If that card's mana value is less than or equal to the sacrificed artifact's mana value, put it onto the battlefield. If it's greater, you may pay {X}, where X is the difference. If you do, put it onto the battlefield. If you don't, put it into its owner's graveyard. Then shuffle.",
    "promotionalDebut": false,
    "identityNotes": "Original Antiquities 1994-03-04 credited to Anson Maddocks; printing ID remains from accepted snapshot. Modern Oracle text is not misidentified as original printed wording. Verified focused mechanics source: https://mtg.wtf/card/atq/14/Transmute-Artifact"
  },
  "originalContext": {
    "setEnvironment": "Antiquities original printing, 1994-03-04",
    "designPurpose": "Transmute Artifact is a tutor with a consequential timing detail: its artifact sacrifice happens when the sorcery resolves, not when the spell is cast. Countering it can prevent any artifact from being sacrificed.",
    "initialReception": "No invented contemporary launch reception. Narrative interpretation is separated from published historical evidence.",
    "sourceIds": [
      "original-printing",
      "official-rules"
    ]
  },
  "loreContext": {
    "scope": "flavor-only",
    "summary": "Original artwork credit Anson Maddocks; no undocumented canonical story or attributed quote invented.",
    "relatedStoryCards": [],
    "sourceIds": [
      "original-printing"
    ]
  },
  "competitiveTimeline": [
    {
      "date": "1994-03-04",
      "event": "Antiquities initial release",
      "significance": "Transmute Artifact initial printed identity; original artist Anson Maddocks.",
      "sourceIds": [
        "original-printing"
      ]
    }
  ],
  "playbook": {
    "role": "Transmute Artifact is a tutor with a consequential timing detail: its artifact sacrifice happens when the sorcery resolves, not when the spell is cast. Countering it can prevent any artifact from being sacrificed.",
    "deckRequirements": "Check color requirements, actual mana producers and supporting card pool; do not infer a historical player from an illustrative scene.",
    "copyCount": "Consult documentary deck rows for exact observed counts; illustrative models do not prove event popularity.",
    "mulligans": "Do not treat a combo or lock piece as a mana source or early threat without the cards required to support it.",
    "sequencing": "With Sol Ring (mana value one) on the battlefield, a resolved Transmute Artifact can sacrifice it and find Mana Vault (also mana value one) without an additional payment. If the search instead finds a more expensive artifact, the difference is paid during resolution; that is not part of the spell's casting cost.",
    "sideboarding": "Specific opponent-dependent decisions require real format/date and opposing deck evidence.",
    "commonMistakes": "Casting costs {U}{U} without sacrificing anything. On resolution its controller sacrifices one artifact, searches for another, and either puts it directly onto the battlefield or pays the mana-value difference. A found higher-value artifact goes to the graveyard if that difference is not paid."
  },
  "counterplay": {
    "directAnswers": "Appropriate counterspells or removal at the legal timing window, or attacking the enabling cards and resources.",
    "engineDisruption": "Check the supporting artifacts, enchantments, creatures or mana engine separately from the featured card.",
    "timingWindows": "With Sol Ring (mana value one) on the battlefield, a resolved Transmute Artifact can sacrifice it and find Mana Vault (also mana value one) without an additional payment. If the search instead finds a more expensive artifact, the difference is paid during resolution; that is not part of the spell's casting cost.",
    "racing": "Compare the setup cost with opposing clock and available mana.",
    "sideboarding": "No blanket sideboard advice without a verified deck pairing."
  },
  "deckEvidence": [
    {
      "deckKind": "curated-example",
      "deckName": "Groundhog Day — Nested Draw Control Old School novelty-control construction · documented 63/15",
      "format": "See article deck archive.",
      "date": "historical",
      "sourceId": "archived-deck-candidate",
      "reviewedBy": "Inherited or newly authored candidate; independent historical attribution is unverified"
    }
  ],
  "claims": [
    {
      "claimId": "printing-identity",
      "summary": "Antiquities 1994-03-04, credited artist Anson Maddocks.",
      "sourceIds": [
        "original-printing"
      ],
      "confidence": "high",
      "asOf": "2026-10-27"
    },
    {
      "claimId": "mechanics-sequence",
      "summary": "Casting costs {U}{U} without sacrificing anything. On resolution its controller sacrifices one artifact, searches for another, and either puts it directly onto the battlefield or pays the mana-value difference. A found higher-value artifact goes to the graveyard if that difference is not paid. With Sol Ring (mana value one) on the battlefield, a resolved Transmute Artifact can sacrifice it and find Mana Vault (also mana value one) without an additional payment. If the search instead finds a more expensive artifact, the difference is paid during resolution; that is not part of the spell's casting cost.",
      "sourceIds": [
        "original-printing",
        "official-rules"
      ],
      "confidence": "high",
      "asOf": "2026-10-27"
    }
  ],
  "sources": [
    {
      "sourceId": "original-printing",
      "title": "Transmute Artifact original printing and rulings",
      "url": "https://mtg.wtf/card/atq/14/Transmute-Artifact",
      "sourceType": "database",
      "accessedDate": "2026-10-27",
      "supports": "Original date, printed card, artist and explicit rulings."
    },
    {
      "sourceId": "official-rules",
      "title": "Magic Comprehensive Rules",
      "url": "https://magic.wizards.com/en/rules",
      "sourceType": "primary",
      "accessedDate": "2026-10-27",
      "supports": "Current triggered ability, costs, timing, targeting, casting and resolution mechanics."
    },
    {
      "sourceId": "archived-deck-candidate",
      "title": "Preserved Compulsive Research deck-archive entry — external verification pending",
      "url": "https://github.com/Diabolicdonut/Compulsive-Research/blob/main/071-transmute-artifact.html",
      "sourceType": "database",
      "accessedDate": "2026-10-27",
      "supports": "Only the text of a preserved candidate deck list, NOT verification of player, date, registration or placement."
    }
  ],
  "researchStatus": "in-research",
  "review": {
    "historicalReviewDate": "2026-10-27",
    "currentInformationAsOf": "2026-10-27",
    "editorialReviewer": "Compulsive Research focused 063-072 candidate preparation",
    "openQuestions": [
      "Verify inherited third-party tournament registrations and older article sections separately. These core-mechanics fixes alone do not accept the complete Reader migration wave."
    ]
  }
}
