{
  "schemaVersion": "2.0",
  "cardName": "Millstone",
  "articleClass": "tournament-pillar",
  "secondaryClasses": [],
  "thesis": "Millstone gave control decks a repeatable win condition that ignored life totals and eventually lent its name to the entire strategy of milling libraries.",
  "canonicalIdentity": {
    "oracleId": "3212e47a-5492-4c50-9d4a-6ea562f1a6e1",
    "oracleName": "Millstone",
    "firstPrintingSetCode": "atq",
    "firstPrintingSetName": "Antiquities",
    "releaseDate": "1994-03-04",
    "scryfallId": "107646bc-2181-49f4-8821-1eaa46291855",
    "illustrationId": "a7e65996-a6e3-4f5c-9b97-136f6fac698e",
    "originalArtist": "Kaja Foglio",
    "originalPrintedText": "{2}, {T}: Target player mills two cards.",
    "currentOracleText": "{2}, {T}: Target player mills two cards.",
    "promotionalDebut": false,
    "identityNotes": "Canonical identity pinned to the project card-data snapshot and original regular printing."
  },
  "originalContext": {
    "setEnvironment": "Original release in Antiquities.",
    "designPurpose": "Millstone gave control decks a repeatable win condition that ignored life totals and eventually lent its name to the entire strategy of milling libraries.",
    "initialReception": "The article distinguishes the original card from its later tournament and cultural reputation.",
    "sourceIds": [
      "source-1",
      "source-2",
      "source-3"
    ]
  },
  "loreContext": {
    "scope": "flavor-only",
    "summary": "Artwork, setting, and cultural claims are limited to evidence retained in the article.",
    "depictedMoment": "See the article artwork and memory sections.",
    "relatedStoryCards": [],
    "sourceIds": [
      "source-1",
      "source-2"
    ]
  },
  "competitiveTimeline": [
    {
      "date": "historical",
      "significance": "From early control to dedicated prison and casual decks, Millstone transformed an obscure loss condition into one of Magic’s permanent strategic vocabularies.",
      "sourceIds": [
        "source-1",
        "source-2",
        "source-3",
        "source-4",
        "source-5",
        "source-6",
        "source-7",
        "source-8",
        "source-9"
      ]
    }
  ],
  "playbook": {
    "role": "Stabilize the battlefield before investing mana in activations, and count the opponent’s remaining draw steps rather than treating every mill as immediate progress.",
    "deckRequirements": "The article identifies the mana, card-type, or structural requirements that make the card one-sided.",
    "copyCount": "Historical registrations preserve recorded copy counts.",
    "mulligans": "Opening hands are evaluated according to whether the featured card advances a coherent plan.",
    "sequencing": "Stabilize the battlefield before investing mana in activations, and count the opponent’s remaining draw steps rather than treating every mill as immediate progress.",
    "sideboarding": "Historical and format-specific roles are discussed where applicable.",
    "commonMistakes": "The strategic brief identifies the most common sequencing or evaluation error."
  },
  "counterplay": {
    "directAnswers": "Pressure the controller, remove the artifact, reshuffle the graveyard, or deploy a faster alternate plan. Extra cards drawn can accelerate the loss if the library is already under attack.",
    "engineDisruption": "The article distinguishes the featured card from the mana, graveyard, creature, or artifact engine supporting it.",
    "timingWindows": "Pressure the controller, remove the artifact, reshuffle the graveyard, or deploy a faster alternate plan. Extra cards drawn can accelerate the loss if the library is already under attack.",
    "racing": "The article explains when pressure is superior to direct interaction.",
    "sideboarding": "Broad answer classes are documented."
  },
  "deckEvidence": [
    {
      "deckKind": "tournament-registration",
      "deckName": "Andrea Redi — Mono-Red Vise Control World Championship 1995 · Quarterfinalist · 60/15",
      "format": "See article deck archive.",
      "date": "historical",
      "sourceId": "source-1",
      "reviewedBy": "Compulsive Research editorial review"
    },
    {
      "deckKind": "tournament-registration",
      "deckName": "Michael Loconto — Pro Tour New York 1996 Winner · 4ED-HML standard · 1996-02-18",
      "format": "See article deck archive.",
      "date": "historical",
      "sourceId": "source-2",
      "reviewedBy": "Compulsive Research editorial review"
    },
    {
      "deckKind": "tournament-registration",
      "deckName": "Shawn Regnier — Pro Tour New York 1996 7th place · 4ED-HML standard · 1996-02-18",
      "format": "See article deck archive.",
      "date": "historical",
      "sourceId": "source-3",
      "reviewedBy": "Compulsive Research editorial review"
    }
  ],
  "claims": [
    {
      "claimId": "central-thesis",
      "summary": "Millstone gave control decks a repeatable win condition that ignored life totals and eventually lent its name to the entire strategy of milling libraries.",
      "sourceIds": [
        "source-1",
        "source-2",
        "source-3",
        "source-4",
        "source-5",
        "source-6",
        "source-7",
        "source-8"
      ],
      "confidence": "high",
      "asOf": "2026-08-03"
    }
  ],
  "sources": [
    {
      "sourceId": "source-1",
      "title": "Magic Comprehensive Rules",
      "url": "https://magic.wizards.com/en/rules",
      "sourceType": "primary",
      "accessedDate": "2026-08-03",
      "supports": "Identity, rules, historical context, deck provenance, printings, or legality."
    },
    {
      "sourceId": "source-2",
      "title": "Gatherer — Millstone",
      "url": "https://gatherer.wizards.com/Pages/Search/Default.aspx?name=%2B%5BMillstone%5D",
      "sourceType": "primary",
      "accessedDate": "2026-08-03",
      "supports": "Identity, rules, historical context, deck provenance, printings, or legality."
    },
    {
      "sourceId": "source-3",
      "title": "Scryfall — Millstone",
      "url": "https://scryfall.com/card/atq/56/millstone",
      "sourceType": "database",
      "accessedDate": "2026-08-03",
      "supports": "Identity, rules, historical context, deck provenance, printings, or legality."
    },
    {
      "sourceId": "source-4",
      "title": "Open the published tournament-deck compilation",
      "url": "https://github.com/ajlvi/pt-decks-csv",
      "sourceType": "database",
      "accessedDate": "2026-08-03",
      "supports": "Identity, rules, historical context, deck provenance, printings, or legality."
    },
    {
      "sourceId": "source-5",
      "title": "open the documented deck record",
      "url": "https://mtg.wiki/wiki/Pro_Tour_Collector_Set",
      "sourceType": "database",
      "accessedDate": "2026-08-03",
      "supports": "Identity, rules, historical context, deck provenance, printings, or legality."
    },
    {
      "sourceId": "source-6",
      "title": "Scryfall printing catalog for Millstone",
      "url": "https://scryfall.com/search?q=%21%22Millstone%22&unique=prints&as=grid&order=released",
      "sourceType": "database",
      "accessedDate": "2026-08-03",
      "supports": "Identity, rules, historical context, deck provenance, printings, or legality."
    },
    {
      "sourceId": "source-7",
      "title": "Gatherer card record",
      "url": "https://gatherer.wizards.com/Pages/Search/Default.aspx?name=%2B%5BMillstone%5D",
      "sourceType": "primary",
      "accessedDate": "2026-08-03",
      "supports": "Identity, rules, historical context, deck provenance, printings, or legality."
    },
    {
      "sourceId": "source-8",
      "title": "MTGJSON AllPrintings",
      "url": "https://mtgjson.com/downloads/all-files/",
      "sourceType": "database",
      "accessedDate": "2026-08-03",
      "supports": "Identity, rules, historical context, deck provenance, printings, or legality."
    },
    {
      "sourceId": "source-9",
      "title": "MTGTop8 tournament archive",
      "url": "https://www.mtgtop8.com/",
      "sourceType": "database",
      "accessedDate": "2026-08-03",
      "supports": "Identity, rules, historical context, deck provenance, printings, or legality."
    }
  ],
  "researchStatus": "complete",
  "review": {
    "historicalReviewDate": "2026-08-03",
    "currentInformationAsOf": "2026-08-03",
    "editorialReviewer": "Compulsive Research editorial review",
    "openQuestions": []
  }
}
