{
  "schemaVersion": "2.0",
  "cardName": "The Tabernacle at Pendrell Vale",
  "articleClass": "tournament-pillar",
  "secondaryClasses": [],
  "thesis": "The Tabernacle at Pendrell Vale taxes every creature each upkeep, turning a land into a sweeping economic rule that rewards decks built with few creatures and abundant mana denial.",
  "canonicalIdentity": {
    "oracleId": "69b409b3-fa16-4c79-8b46-215a7036ed46",
    "oracleName": "The Tabernacle at Pendrell Vale",
    "firstPrintingSetCode": "leg",
    "firstPrintingSetName": "Legends",
    "releaseDate": "1994-06-01",
    "scryfallId": "64bc9b1d-5818-4d9e-b771-e49af4ff9a5c",
    "illustrationId": "9da32220-142e-40dc-ab89-47bbf1efc1fd",
    "originalArtist": "Nicola Leonard",
    "originalPrintedText": "All creatures have \"At the beginning of your upkeep, destroy this creature unless you pay {1}.\"",
    "currentOracleText": "All creatures have \"At the beginning of your upkeep, destroy this creature unless you pay {1}.\"",
    "promotionalDebut": false,
    "identityNotes": "Canonical identity pinned to the project card-data snapshot and original regular printing."
  },
  "originalContext": {
    "setEnvironment": "Original release in Legends.",
    "designPurpose": "The Tabernacle at Pendrell Vale taxes every creature each upkeep, turning a land into a sweeping economic rule that rewards decks built with few creatures and abundant mana denial.",
    "initialReception": "The article distinguishes the original card from its later tournament and cultural reputation.",
    "sourceIds": [
      "source-1",
      "source-2",
      "source-3"
    ]
  },
  "loreContext": {
    "scope": "flavor-only",
    "summary": "Artwork, setting, and cultural claims are limited to evidence retained in the article.",
    "depictedMoment": "See the article artwork and memory sections.",
    "relatedStoryCards": [],
    "sourceIds": [
      "source-1",
      "source-2"
    ]
  },
  "competitiveTimeline": [
    {
      "date": "historical",
      "significance": "Tabernacle became a signature card of Lands and prison strategies and one of the clearest examples of a Reserved List land whose strategic identity outgrew its original context.",
      "sourceIds": [
        "source-1",
        "source-2",
        "source-3",
        "source-4",
        "source-5",
        "source-6",
        "source-7",
        "source-8",
        "source-9"
      ]
    }
  ],
  "playbook": {
    "role": "Pair Tabernacle with Wasteland, Rishadan Port, sweepers, or token control so the upkeep tax becomes impossible to pay. Track triggers precisely; the card wins through accumulated missed development.",
    "deckRequirements": "The article identifies the mana, card-type, or structural requirements that make the card one-sided.",
    "copyCount": "Historical registrations preserve recorded copy counts.",
    "mulligans": "Opening hands are evaluated according to whether the featured card advances a coherent plan.",
    "sequencing": "Pair Tabernacle with Wasteland, Rishadan Port, sweepers, or token control so the upkeep tax becomes impossible to pay. Track triggers precisely; the card wins through accumulated missed development.",
    "sideboarding": "Historical and format-specific roles are discussed where applicable.",
    "commonMistakes": "The strategic brief identifies the most common sequencing or evaluation error."
  },
  "counterplay": {
    "directAnswers": "Prioritize the creatures that justify their upkeep, develop extra mana, and remove or copy the land when possible. Token plans are especially vulnerable unless they can end the game immediately.",
    "engineDisruption": "The article distinguishes the featured card from the mana, graveyard, creature, or artifact engine supporting it.",
    "timingWindows": "Prioritize the creatures that justify their upkeep, develop extra mana, and remove or copy the land when possible. Token plans are especially vulnerable unless they can end the game immediately.",
    "racing": "The article explains when pressure is superior to direct interaction.",
    "sideboarding": "Broad answer classes are documented."
  },
  "deckEvidence": [
    {
      "deckKind": "tournament-registration",
      "deckName": "Jarvis Yu — Lands Grand Prix Seattle-Tacoma 2015 · Champion · Legacy",
      "format": "See article deck archive.",
      "date": "historical",
      "sourceId": "source-1",
      "reviewedBy": "Compulsive Research editorial review"
    },
    {
      "deckKind": "tournament-registration",
      "deckName": "LogT1 — Bant Beanstalk Control 2023 Asia Vintage Championship · Bant Control",
      "format": "See article deck archive.",
      "date": "historical",
      "sourceId": "source-2",
      "reviewedBy": "Compulsive Research editorial review"
    },
    {
      "deckKind": "tournament-registration",
      "deckName": "Max Gilmore — Esper Control 2024 North American Vintage Champion",
      "format": "See article deck archive.",
      "date": "historical",
      "sourceId": "source-3",
      "reviewedBy": "Compulsive Research editorial review"
    },
    {
      "deckKind": "curated-example",
      "deckName": "Old School 93/94 — Workshop Prison Representative community construction · 60/15",
      "format": "See article deck archive.",
      "date": "historical",
      "sourceId": "source-4",
      "reviewedBy": "Compulsive Research editorial review"
    },
    {
      "deckKind": "tournament-registration",
      "deckName": "Takakuwa Yuusuke — Vintage Stax 10th Vintage God Challenger Event · Top 8 · 60/15",
      "format": "See article deck archive.",
      "date": "historical",
      "sourceId": "source-5",
      "reviewedBy": "Compulsive Research editorial review"
    }
  ],
  "claims": [
    {
      "claimId": "central-thesis",
      "summary": "The Tabernacle at Pendrell Vale taxes every creature each upkeep, turning a land into a sweeping economic rule that rewards decks built with few creatures and abundant mana denial.",
      "sourceIds": [
        "source-1",
        "source-2",
        "source-3",
        "source-4",
        "source-5",
        "source-6",
        "source-7",
        "source-8"
      ],
      "confidence": "high",
      "asOf": "2026-08-03"
    }
  ],
  "sources": [
    {
      "sourceId": "source-1",
      "title": "Magic Comprehensive Rules",
      "url": "https://magic.wizards.com/en/rules",
      "sourceType": "primary",
      "accessedDate": "2026-08-03",
      "supports": "Identity, rules, historical context, deck provenance, printings, or legality."
    },
    {
      "sourceId": "source-2",
      "title": "Gatherer — The Tabernacle at Pendrell Vale",
      "url": "https://gatherer.wizards.com/Pages/Search/Default.aspx?name=%2B%5BThe%20Tabernacle%20at%20Pendrell%20Vale%5D",
      "sourceType": "primary",
      "accessedDate": "2026-08-03",
      "supports": "Identity, rules, historical context, deck provenance, printings, or legality."
    },
    {
      "sourceId": "source-3",
      "title": "Scryfall — The Tabernacle at Pendrell Vale",
      "url": "https://scryfall.com/card/leg/307/the-tabernacle-at-pendrell-vale",
      "sourceType": "database",
      "accessedDate": "2026-08-03",
      "supports": "Identity, rules, historical context, deck provenance, printings, or legality."
    },
    {
      "sourceId": "source-4",
      "title": "open the historical record",
      "url": "https://mtgdecks.net/Vintage/bant-control-decklist-by-logt1-1812565",
      "sourceType": "database",
      "accessedDate": "2026-08-03",
      "supports": "Identity, rules, historical context, deck provenance, printings, or legality."
    },
    {
      "sourceId": "source-5",
      "title": "open the historical record",
      "url": "https://articles.starcitygames.com/magic-the-gathering/top-decks-and-winners-from-north-american-eternal-weekend-2024/",
      "sourceType": "database",
      "accessedDate": "2026-08-03",
      "supports": "Identity, rules, historical context, deck provenance, printings, or legality."
    },
    {
      "sourceId": "source-6",
      "title": "Scryfall printing catalog for The Tabernacle at Pendrell Vale",
      "url": "https://scryfall.com/search?q=%21%22The+Tabernacle+at+Pendrell+Vale%22&unique=prints&as=grid&order=released",
      "sourceType": "database",
      "accessedDate": "2026-08-03",
      "supports": "Identity, rules, historical context, deck provenance, printings, or legality."
    },
    {
      "sourceId": "source-7",
      "title": "Gatherer card record",
      "url": "https://gatherer.wizards.com/Pages/Search/Default.aspx?name=%2B%5BThe%20Tabernacle%20at%20Pendrell%20Vale%5D",
      "sourceType": "primary",
      "accessedDate": "2026-08-03",
      "supports": "Identity, rules, historical context, deck provenance, printings, or legality."
    },
    {
      "sourceId": "source-8",
      "title": "MTGJSON AllPrintings",
      "url": "https://mtgjson.com/downloads/all-files/",
      "sourceType": "database",
      "accessedDate": "2026-08-03",
      "supports": "Identity, rules, historical context, deck provenance, printings, or legality."
    },
    {
      "sourceId": "source-9",
      "title": "MTGTop8 tournament archive",
      "url": "https://www.mtgtop8.com/",
      "sourceType": "database",
      "accessedDate": "2026-08-03",
      "supports": "Identity, rules, historical context, deck provenance, printings, or legality."
    }
  ],
  "researchStatus": "complete",
  "review": {
    "historicalReviewDate": "2026-08-03",
    "currentInformationAsOf": "2026-08-03",
    "editorialReviewer": "Compulsive Research editorial review",
    "openQuestions": []
  }
}
